{
  "schema": "group-c-manifest/v1",
  "group_id": "agent-workflows.group.C",
  "implementation_kind": "skill",
  "contracts": [
    {"qualified_id": "group.C.C1", "local_id": "C1", "status": "candidate-source", "source_ref": {"path": "agent-workflows/skills/decompose-outcomes/SKILL.md", "digest": "sha256:1111111111111111111111111111111111111111111111111111111111111111"}, "selector_ref": {"path": "agent-workflows/src/ai_agent_workflow/outcome_system.py", "digest": "sha256:aaaaaaaaaaaaaaaaaaaaaaaaaaaaaaaaaaaaaaaaaaaaaaaaaaaaaaaaaaaaaaaa", "selector": "OutcomeSystemV1.decompose_outcomes"}, "receipt_ref": {"path": "agent-workflows/evidence/contracts/C1.json", "digest": "sha256:2222222222222222222222222222222222222222222222222222222222222222"}},
    {"qualified_id": "group.C.C2", "local_id": "C2", "status": "candidate-source", "source_ref": {"path": "agent-workflows/skills/build-outcome-dependency-graph/SKILL.md", "digest": "sha256:1111111111111111111111111111111111111111111111111111111111111111"}, "selector_ref": {"path": "agent-workflows/src/ai_agent_workflow/outcome_system.py", "digest": "sha256:aaaaaaaaaaaaaaaaaaaaaaaaaaaaaaaaaaaaaaaaaaaaaaaaaaaaaaaaaaaaaaaa", "selector": "OutcomeSystemV1.build_dependency_graph"}, "receipt_ref": {"path": "agent-workflows/evidence/contracts/C2.json", "digest": "sha256:2222222222222222222222222222222222222222222222222222222222222222"}},
    {"qualified_id": "group.C.C3", "local_id": "C3", "status": "candidate-source", "source_ref": {"path": "agent-workflows/skills/design-measurement/SKILL.md", "digest": "sha256:1111111111111111111111111111111111111111111111111111111111111111"}, "selector_ref": {"path": "agent-workflows/src/ai_agent_workflow/outcome_system.py", "digest": "sha256:aaaaaaaaaaaaaaaaaaaaaaaaaaaaaaaaaaaaaaaaaaaaaaaaaaaaaaaaaaaaaaaa", "selector": "OutcomeSystemV1.design_measurement"}, "receipt_ref": {"path": "agent-workflows/evidence/contracts/C3.json", "digest": "sha256:2222222222222222222222222222222222222222222222222222222222222222"}},
    {"qualified_id": "group.C.C4", "local_id": "C4", "status": "candidate-source", "source_ref": {"path": "agent-workflows/skills/define-targets/SKILL.md", "digest": "sha256:1111111111111111111111111111111111111111111111111111111111111111"}, "selector_ref": {"path": "agent-workflows/src/ai_agent_workflow/outcome_system.py", "digest": "sha256:aaaaaaaaaaaaaaaaaaaaaaaaaaaaaaaaaaaaaaaaaaaaaaaaaaaaaaaaaaaaaaaa", "selector": "OutcomeSystemV1.define_targets"}, "receipt_ref": {"path": "agent-workflows/evidence/contracts/C4.json", "digest": "sha256:2222222222222222222222222222222222222222222222222222222222222222"}},
    {"qualified_id": "group.C.C5", "local_id": "C5", "status": "candidate-source", "source_ref": {"path": "agent-workflows/skills/capture-baseline/SKILL.md", "digest": "sha256:1111111111111111111111111111111111111111111111111111111111111111"}, "selector_ref": {"path": "agent-workflows/src/ai_agent_workflow/outcome_system.py", "digest": "sha256:aaaaaaaaaaaaaaaaaaaaaaaaaaaaaaaaaaaaaaaaaaaaaaaaaaaaaaaaaaaaaaaa", "selector": "OutcomeSystemV1.record_baseline"}, "receipt_ref": {"path": "agent-workflows/evidence/contracts/C5.json", "digest": "sha256:2222222222222222222222222222222222222222222222222222222222222222"}},
    {"qualified_id": "group.C.C6", "local_id": "C6", "status": "candidate-source", "source_ref": {"path": "agent-workflows/skills/validate-outcome-system/SKILL.md", "digest": "sha256:1111111111111111111111111111111111111111111111111111111111111111"}, "selector_ref": {"path": "agent-workflows/src/ai_agent_workflow/outcome_system.py", "digest": "sha256:aaaaaaaaaaaaaaaaaaaaaaaaaaaaaaaaaaaaaaaaaaaaaaaaaaaaaaaaaaaaaaaa", "selector": "OutcomeSystemV1.validate_system"}, "receipt_ref": {"path": "agent-workflows/evidence/contracts/C6.json", "digest": "sha256:2222222222222222222222222222222222222222222222222222222222222222"}}
  ]
}
