{
  "schema": "group-c-manifest/v1",
  "group_id": "agent-workflows.group.C",
  "implementation_kind": "skill",
  "contracts": [
    {"qualified_id":"group.C.C1","local_id":"C1","status":"candidate-source","source_ref":{"path":"agent-workflows/skills/decompose-outcomes/SKILL.md","digest":"sha256:d05721de81aae76fe1b2f972d7769b6add81bae0d01131abaf37c0b693a19e22"},"selector_ref":{"path":"agent-workflows/src/ai_agent_workflow/outcome_system.py","digest":"sha256:e4ab3113da334ad15c842aa656fae52a5c84e3b4ce5f90f1b39aacb83989d646","selector":"OutcomeSystemV1.decompose_outcomes"},"receipt_ref":{"path":"agent-workflows/tests/test_outcome_system.py","digest":"sha256:d35eab600b63d9949e7958f792bd6b2bfe8bcd0538f6f53ec6e10aaffadc6cca"}},
    {"qualified_id":"group.C.C2","local_id":"C2","status":"candidate-source","source_ref":{"path":"agent-workflows/skills/build-outcome-dependency-graph/SKILL.md","digest":"sha256:21dbb0d8b817e8b3f43c97e11e0d1c4a4fc36baa9ae03b662f046db0c2bd6620"},"selector_ref":{"path":"agent-workflows/src/ai_agent_workflow/outcome_system.py","digest":"sha256:e4ab3113da334ad15c842aa656fae52a5c84e3b4ce5f90f1b39aacb83989d646","selector":"OutcomeSystemV1.build_dependency_graph"},"receipt_ref":{"path":"agent-workflows/tests/test_outcome_system.py","digest":"sha256:d35eab600b63d9949e7958f792bd6b2bfe8bcd0538f6f53ec6e10aaffadc6cca"}},
    {"qualified_id":"group.C.C3","local_id":"C3","status":"candidate-source","source_ref":{"path":"agent-workflows/skills/design-measurement/SKILL.md","digest":"sha256:4130fc9256b7b3fad4ee83b5574f6fe96fdad62bed4781b6ef0d04d25ea4e45f"},"selector_ref":{"path":"agent-workflows/src/ai_agent_workflow/outcome_system.py","digest":"sha256:e4ab3113da334ad15c842aa656fae52a5c84e3b4ce5f90f1b39aacb83989d646","selector":"OutcomeSystemV1.design_measurement"},"receipt_ref":{"path":"agent-workflows/tests/test_outcome_system.py","digest":"sha256:d35eab600b63d9949e7958f792bd6b2bfe8bcd0538f6f53ec6e10aaffadc6cca"}},
    {"qualified_id":"group.C.C4","local_id":"C4","status":"candidate-source","source_ref":{"path":"agent-workflows/skills/define-targets/SKILL.md","digest":"sha256:50a3c94141dcb710fc45d9ad5b8d71d26cc1d0d3ec18dcac17c3af64f96c23de"},"selector_ref":{"path":"agent-workflows/src/ai_agent_workflow/outcome_system.py","digest":"sha256:e4ab3113da334ad15c842aa656fae52a5c84e3b4ce5f90f1b39aacb83989d646","selector":"OutcomeSystemV1.define_targets"},"receipt_ref":{"path":"agent-workflows/tests/test_outcome_system.py","digest":"sha256:d35eab600b63d9949e7958f792bd6b2bfe8bcd0538f6f53ec6e10aaffadc6cca"}},
    {"qualified_id":"group.C.C5","local_id":"C5","status":"candidate-source","source_ref":{"path":"agent-workflows/skills/capture-baseline/SKILL.md","digest":"sha256:5e9b837ca92d55705d5345983d211e7f9f8d2cd468c3a570f29e134729e5b496"},"selector_ref":{"path":"agent-workflows/src/ai_agent_workflow/outcome_system.py","digest":"sha256:e4ab3113da334ad15c842aa656fae52a5c84e3b4ce5f90f1b39aacb83989d646","selector":"OutcomeSystemV1.record_baseline"},"receipt_ref":{"path":"agent-workflows/tests/test_outcome_system.py","digest":"sha256:d35eab600b63d9949e7958f792bd6b2bfe8bcd0538f6f53ec6e10aaffadc6cca"}},
    {"qualified_id":"group.C.C6","local_id":"C6","status":"candidate-source","source_ref":{"path":"agent-workflows/skills/validate-outcome-system/SKILL.md","digest":"sha256:6d56e16603b2332e58663287170b1709ce2aeed227cb1d0640ba94ce95119565"},"selector_ref":{"path":"agent-workflows/src/ai_agent_workflow/outcome_system.py","digest":"sha256:e4ab3113da334ad15c842aa656fae52a5c84e3b4ce5f90f1b39aacb83989d646","selector":"OutcomeSystemV1.validate_system"},"receipt_ref":{"path":"agent-workflows/tests/test_outcome_system.py","digest":"sha256:d35eab600b63d9949e7958f792bd6b2bfe8bcd0538f6f53ec6e10aaffadc6cca"}}
  ]
}
